{
  "id": "admin_sess_lab_001",
  "tenant_id": "tenant_lab",
  "admin_principal_id": "admin_user_lab_001",
  "subject": "oidc-sub-admin-lab-001",
  "roles": [
    "admin",
    "analyst"
  ],
  "auth_time": "2026-05-23T01:00:00Z",
  "mfa_state": "fresh",
  "source_ip": "127.0.0.1",
  "user_agent": "phase1-lab",
  "created_at": "2026-05-23T01:00:00Z",
  "expires_at": "2026-05-23T09:00:00Z",
  "last_active_at": "2026-05-23T01:10:00Z",
  "status": "active",
  "metadata": {
    "cookie_name": "admin_session",
    "csrf_token": "csrf_lab_session_secret_001"
  }
}
